{
  "$schema": "./official-app-releases.schema.json",
  "schemaVersion": 2,
  "channel": "production",
  "updatedAt": "2026-08-30T00:00:00Z",
  "authority": {
    "repository": "readysteadyscience/Rabbisir-Releases",
    "appcastURL": "https://raw.githubusercontent.com/readysteadyscience/Rabbisir-Releases/main/appcast.xml",
    "stableDownloadURL": "https://github.com/readysteadyscience/Rabbisir-Releases/releases/latest/download/Rabbisir.dmg"
  },
  "latest": {
    "version": "0.3.0",
    "build": "8",
    "tag": "v0.3.0"
  },
  "releases": [
    {
      "version": "0.3.0",
      "build": "8",
      "tag": "v0.3.0",
      "publishedOn": "2026-08-30",
      "selectedTypes": [
        "optimization"
      ],
      "categories": {
        "optimization": [
          {
            "zh": "优化纯文本、Markdown、文稿和 PDF 原生工作台，统一编辑、预览、保存与 A4 分页体验。",
            "en": "Improves the native text, Markdown, document, and PDF workbenches with consistent editing, preview, saving, and A4 pagination."
          },
          {
            "zh": "优化任务终态与输入提交流程，使停止、完成和中文输入在延迟回调与重连场景下更稳定。",
            "en": "Improves task completion and composer submission so stopping, completion, and Chinese input remain stable across delayed callbacks and reconnects."
          },
          {
            "zh": "优化任务产物的自动呈现与安全内部预览，避免重复标签、抢焦点或覆盖未保存编辑。",
            "en": "Improves automatic artifact presentation and secure internal previews while avoiding duplicate tabs, focus stealing, and unsaved-edit replacement."
          },
          {
            "zh": "优化长会话增量投影、有界缓冲与缺口修复，提升流式内容的响应和恢复可靠性。",
            "en": "Improves long-conversation incremental projection, bounded buffering, and gap repair for more responsive and reliable streaming recovery."
          }
        ]
      },
      "releaseURL": "https://github.com/readysteadyscience/Rabbisir-Releases/releases/tag/v0.3.0",
      "assets": [
        {
          "name": "Rabbisir-0.3.0-8.zip",
          "url": "https://github.com/readysteadyscience/Rabbisir-Releases/releases/download/v0.3.0/Rabbisir-0.3.0-8.zip",
          "size": 134526070,
          "sha256": "267b80d6248bf2eba0a3a5795c97399623a37b787302f7ae9958f5f2c1cc6b3a"
        },
        {
          "name": "Rabbisir-0.3.0-8.dmg",
          "url": "https://github.com/readysteadyscience/Rabbisir-Releases/releases/download/v0.3.0/Rabbisir-0.3.0-8.dmg",
          "size": 97374345,
          "sha256": "ee58509ad769b8361e0b6ecf728d371b117aed8994738548d4fedd9d41df26d6"
        },
        {
          "name": "Rabbisir.dmg",
          "url": "https://github.com/readysteadyscience/Rabbisir-Releases/releases/download/v0.3.0/Rabbisir.dmg",
          "size": 97374345,
          "sha256": "ee58509ad769b8361e0b6ecf728d371b117aed8994738548d4fedd9d41df26d6"
        }
      ]
    },
    {
      "version": "0.2.0",
      "build": "7",
      "tag": "v0.2.0",
      "publishedOn": "2026-08-27",
      "selectedTypes": [
        "optimization",
        "fix"
      ],
      "categories": {
        "optimization": [
          {
            "zh": "优化终端高输出、长会话流式内容、代码高亮、图片与 Artifact 预览的增量处理，提升长时间使用时的响应与资源稳定性。",
            "en": "Improves incremental handling for terminal output, long conversation streams, code highlighting, images, and artifact previews to improve responsiveness and resource stability."
          },
          {
            "zh": "优化运行时、会话与后台任务生命周期，降低重复解析、无界队列和残留进程风险。",
            "en": "Improves runtime, session, and background-task lifecycles to reduce duplicate parsing, unbounded queues, and lingering processes."
          },
          {
            "zh": "优化自动浏览预览缓存与界面热点，保留用户手动标签并改善导航、面板和输入区域的流畅度。",
            "en": "Improves automatic preview caching and interface hot paths while preserving manually opened tabs and smoothing navigation, panels, and composition."
          }
        ],
        "fix": [
          {
            "zh": "修复退出时终端进程组和端口未可靠释放的问题。",
            "en": "Fixes terminal process groups and ports not being released reliably on exit."
          },
          {
            "zh": "修复工作区文件预览中的路径竞态，并加强运行时来源完整性复核。",
            "en": "Fixes a workspace file-preview path race and strengthens runtime provenance revalidation."
          },
          {
            "zh": "修复 Keychain 保存后重启失败及文档元数据失败时状态提示不准确的问题。",
            "en": "Fixes inaccurate status reporting when restart fails after Keychain storage or document metadata fails after content is saved."
          },
          {
            "zh": "修复长会话流可能持续保活、辅助功能标签未随语言更新的问题。",
            "en": "Fixes long-running conversation streams retaining state and accessibility labels not following language changes."
          },
          {
            "zh": "修复中文输入法候选提交内容可能被旧草稿清空的问题。",
            "en": "Fixes committed Chinese input-method text being cleared by a stale draft."
          },
          {
            "zh": "修复短用户消息未按自然宽度贴右显示的问题。",
            "en": "Fixes short user messages not using their natural right-aligned width."
          }
        ]
      },
      "releaseURL": "https://github.com/readysteadyscience/Rabbisir-Releases/releases/tag/v0.2.0",
      "assets": [
        {
          "name": "Rabbisir-0.2.0-7.zip",
          "url": "https://github.com/readysteadyscience/Rabbisir-Releases/releases/download/v0.2.0/Rabbisir-0.2.0-7.zip",
          "size": 133591473,
          "sha256": "5587a7f3502e42b258bb65375a5ef99de3542bcdf30aa638c2b7b839bcefda67"
        },
        {
          "name": "Rabbisir-0.2.0-7.dmg",
          "url": "https://github.com/readysteadyscience/Rabbisir-Releases/releases/download/v0.2.0/Rabbisir-0.2.0-7.dmg",
          "size": 96452799,
          "sha256": "1312b36b050ac2c371fdd093e5d45918ba4b96b9426273301a7785bab53e15ad"
        },
        {
          "name": "Rabbisir.dmg",
          "url": "https://github.com/readysteadyscience/Rabbisir-Releases/releases/download/v0.2.0/Rabbisir.dmg",
          "size": 96452799,
          "sha256": "1312b36b050ac2c371fdd093e5d45918ba4b96b9426273301a7785bab53e15ad"
        }
      ]
    },
    {
      "version": "0.1.4",
      "build": "6",
      "tag": "v0.1.4",
      "publishedOn": "2026-08-26",
      "selectedTypes": [
        "fix"
      ],
      "categories": {
        "fix": [
          {
            "zh": "修复上一版本中已确认的问题。",
            "en": "Resolves verified issues from the previous version."
          }
        ]
      },
      "releaseURL": "https://github.com/readysteadyscience/Rabbisir-Releases/releases/tag/v0.1.4",
      "assets": [
        {
          "name": "Rabbisir-0.1.4-6.zip",
          "url": "https://github.com/readysteadyscience/Rabbisir-Releases/releases/download/v0.1.4/Rabbisir-0.1.4-6.zip",
          "size": 133310314,
          "sha256": "ee8f4dacc741da9c3f63edeecb4e0e13d0f0cc2d6322b214d21ec1a1398747b4"
        },
        {
          "name": "Rabbisir-0.1.4-6.dmg",
          "url": "https://github.com/readysteadyscience/Rabbisir-Releases/releases/download/v0.1.4/Rabbisir-0.1.4-6.dmg",
          "size": 96167229,
          "sha256": "866917485b24a217c56d63b0419a11e2c731149f39c4ece773202730ade0761e"
        },
        {
          "name": "Rabbisir.dmg",
          "url": "https://github.com/readysteadyscience/Rabbisir-Releases/releases/download/v0.1.4/Rabbisir.dmg",
          "size": 96167229,
          "sha256": "866917485b24a217c56d63b0419a11e2c731149f39c4ece773202730ade0761e"
        }
      ]
    }
  ]
}
